id,title,channel_id,channel_name,published_date,description
gO7U3ibtCPA,Polkadot: Can DOT Survive The BEAR Market?! Deep Dive!!,UCqK_GSMbpiV8spgD3ZGloSw,Coin Bureau,2022-06-28T14:10:30Z,Get The Hottest Crypto Deals https://guy.coinbureau.com/deals/ Insider Info in my Socials ...
YlAdEQp6ekM,What is Polkadot? DOT Explained with Animations,UCsYYksPHiGqXHPoHI-fm5sg,Whiteboard Crypto,2021-09-18T15:22:45Z,"Polkadot is a project that is attempting to connect a bunch of different blockchains together, similar to how we use a bunch of ..."
H7S5k5jWp48,Polkadot: What&#39;s Up With DOT?! Potential in 2022!!,UCqK_GSMbpiV8spgD3ZGloSw,Coin Bureau,2022-02-17T16:01:08Z,Insider Info in my Socials https://guy.coinbureau.com/socials/ Get The Hottest Crypto Deals ...
C8Oujokm1-M,Polkadot Vs. Cosmos: Which is BEST?! Complete Comparison!!,UCqK_GSMbpiV8spgD3ZGloSw,Coin Bureau,2022-04-30T15:07:18Z,Insider Info in my Socials https://guy.coinbureau.com/socials/ Get The Hottest Crypto Deals ...
X77m8mEcs3Q,How to Retire on Polkadot by 2032 or sooner,UCxdWHEhEPiYhCADMrn4PdhQ,Fin Tek,2022-04-04T21:15:01Z,"Whether you're asking ""What is Polkadot?"" or you're a holder of the DOT token, this deep dive into Polkadot staking will explain ..."
eqV-y8DbJaY,How Much Polkadot (DOT) Do You Need To Become A Cryptocurrency Millionaire in 2022? | Gavin Wood,UCbLhGKVY-bJPcawebgtNfbw,Altcoin Daily,2021-10-12T01:38:02Z,Is DOT a good altcoin investment? Is Polkadot the Ethereum killer? How much Polkadot (DOT) do you need to become a crypto ...
VuPidyYkwLI,"Polkadot DOT Price News Today - Technical Analysis Update Now, Price Now! Elliott Wave Analysis!",UCngIhBkikUe6e7tZTjpKK7Q,More Crypto Online,2022-06-27T21:00:03Z,"Polkadot DOT Price News Today - Technical Analysis Update Now, Price Now! Elliott Wave Analysis! In this video I talk about a ..."
FxxFanDIfL8,TOP 5 Polkadot Projects: 2022 Potential!? 🔝,UCqK_GSMbpiV8spgD3ZGloSw,Coin Bureau,2022-01-12T15:45:41Z,Insider Info in my Socials https://guy.coinbureau.com/socials/ Best Deals in Crypto https://guy.coinbureau.com/deals/ ...
kw8eu2VadFA,What is Polkadot? | A Polkadot for Beginners Guide and Intro to Blockchain,UCB7PbjuZLEba_znc7mEGNgw,Polkadot,2020-05-21T21:48:21Z,0:00 - Opening 3:20 - Brief history of the internet 10:59 - What is blockchain? 25:49 - History of blockchain and crypto 27:34 - What ...
9LT2cdlT2JE,POLKADOT to EXPLODE (LIKE CARDANO)! INSANE CRYPTO PRICE PREDICTION + BEST ALTCOINS 2022,UCbLhGKVY-bJPcawebgtNfbw,Altcoin Daily,2022-04-24T16:09:55Z,"Nuclear Engineer PhD & Crypto Data Analyst Ben Cowen Favorite Altcoins, Polkadot Price Prediction, & MORE! Hit Like, Share ..."
NYBApoZ1VJY,$6 Then $100 Polkadot Price Prediction! Polkadot Drop Then MOONSHOT?!,UCviqt5aaucA1jP3qFmorZLQ,Crypto Jebb,2022-06-10T19:11:53Z,"In this episode, I break down why Polkadot, along with the rest of crypto, will have one final drop followed by a meteoric rise into ..."
nZMXq_1pL0A,Crypto News: Why I&#39;m Buying More DOT POLKADOT,UCd4Ys__EL_gbJrYq6JscrAw,Cheeky Crypto,2022-06-21T02:00:18Z,LOOKING FOR MORE? Our NFT Project https://www.cheekyverse.com/ PATREON https://www.patreon.com/cheekycrypto ...
GcOKXAOh4Xw,"Polkadot Behind the Code, Episode 1: The Idea, featuring Gavin Wood",UCB7PbjuZLEba_znc7mEGNgw,Polkadot,2020-05-26T17:30:16Z,"Gavin Wood, Polkadot founder, Ethereum co-founder and CTO, discusses the idea for Polkadot and his vision for what he hopes it ..."
bjiQCxFhOQM,Polkadot (DOT) Cryptocurrency Explained for Beginners!,UCFBpVaKCC0ajGps1vf0AgBg,Humphrey Yang,2021-12-03T20:00:13Z,Explaining the cryptocurrency Polkadot for Beginners! Enjoy! ▻ Stock Portfolio + Tracker ➭ https://patreon.com/humphreytalks ...
thNBZoORUVY,POLKADOT PRICE PREDICTION 2022 - POLKADOT HONEST ANALYSIS -Buy Set &amp; Forget,UCv7eSSInBPoWlnngdPGX-8g,unisonfinance,2022-06-25T15:15:02Z,Join or FREE Discord Community here: https://discord.gg/MF77JBPfJz ⚡  ✓ LEARN MY STRATEGY FROM ME AND ...
NcgfyBPA0pE,✅COMPRAR O ESPERAR A LA CAÍDA?😱Noticias Criptomonedas Hoy | Cardano | BTC | Polkadot | Solana | ETH,UC-aa-e1LhITL9NmwhX2SdSQ,Punto Cripto,2022-06-28T19:10:48Z,Cuidado las ballenas están sacando dinero del criptomercado Están manipulando el precio de Polkadot Gigante bancario ...
0_LBP78ixAc,"Polkadot Behind the Code, Episode 3: The Ecosystem, featuring Gavin Wood",UCB7PbjuZLEba_znc7mEGNgw,Polkadot,2021-12-18T18:54:38Z,"Gavin Wood, Polkadot founder, Ethereum co-founder and CTO, discusses the idea for Polkadot and his vision for what he hopes it ..."
xBDElXtuaUY,Buy The Dip in Polkadot? - DOT Crypto Analysis,UCfQaLLoJYaxg9ZNJVHCR9Lg,Gerhard - Bitcoin Strategy,2022-06-11T12:01:01Z,Premium Membership: https://the-bitcoin-strategy.com My Chart Software: https://the-bitcoin-strategy.com/tradingview My ...
NDPwgDg9hgo,DIVIDA SEU DINHEIRO - POLKADOT CRESCE - BITCOIN - TERRA LUNA PRESO - CARDANO - CRIPTO NOTÍCIAS HOJE,UCIUeus6e0aacfauLUrNG1dw,Crypto Minuto,2022-06-28T15:01:00Z,Criador da Terra luna está na mira de anônimos Polkadot pode ter um grande aumento por causa disso A crise continua ...
GOS4jPF1i1E,Polkadot Lead Developer on Building &#39;Multi-Chain Future&#39;,UC7TghOL755nBk7HelHoi9LQ,CoinDesk,2022-02-18T18:38:53Z,"Shawn Tabrizi, lead developer at Polkadot network, a framework for connecting various blockchains, shares insights into ..."
TDbTCrDDO2U,Polkadot Decoded 2022: Browser-embedded light clients: how we&#39;re bringing Polkadot to the masses,UCB7PbjuZLEba_znc7mEGNgw,Polkadot,2022-06-29T09:07:02Z,"Speaker: Pierre Krieger, Parity Technologies. POLKADOT DECODED is a virtual conference for the Polkadot community, featuring ..."
jUrvGEVQTeg,The One Altcoin That Every Whale Is Still Holding!,UCN9Nj4tjXbVTLYWN0EKly_Q,Crypto Banter,2022-06-08T02:07:07Z,"Some of the top Altcoins we all thought would never sell off, have now sold off lower than we would have ever imagined! But there ..."
eTON5F_hXMQ,Will Polkadot $DOT Outperform in 2022?,UCi7egjf0JDHuhznWugXq4hA,Coinsider,2022-01-03T16:30:03Z,"After a pretty underwhelming 2021, the big question for DOT investors is: Will Polkadot's $DOT token outperform its peers in 2022 ..."
KAP3OtJ3rHo,Best Cheap Altcoins 2022 (Polkadot Millionaire Makers),UCIEvlRpHBVFthrF6pZzBEXw,MoneyZG,2022-03-14T14:00:08Z,"Best altcoins to buy now? Polkadot Altcoins Astar, Acala, Moonriver and about to roll out. MoneyZG Crypto Course: ..."
oNdPEqMO4yM,Polkadot Projects Will Make Millionaires (100X),UCLr9nHPNpj7U3096nEo8Qfg,Max Maher,2021-12-13T16:42:35Z,Join Finova! (formerly Patreon): https://finova.finance/plans/ Get up to $250 in Bitcoin from Blockfi https://blockfi.com/MaxMaher ...
5-QlqbvU7pU,The Shocking Truth of Cosmos Vs. Polkadot,UCLr9nHPNpj7U3096nEo8Qfg,Max Maher,2021-11-27T18:23:54Z,Cosmos Atom Crypto. Polkadot Crypto. Join Finova! (formerly Patreon): https://finova.finance/plans/ Get up to $250 in Bitcoin ...
98F6h9uCi6A,Polkadot: Should I buy it? Is DOT worth it? A detailed study and Price Prediction out to 2025,UClgJyzwGs-GyaNxUHcLZrkg,InvestAnswers,2021-05-11T02:02:14Z,https://www.patreon.com/InvestAnswers #Polkadot #DOT #DotPricePrediction #Cardano #Ethereum Welcome to the Polkadot ...
SH7RF2NenLY,Polkadot - DOT Still Showing Potential? These 4 Protocols Say YES 💪,UCGyqEtcGQQtXyUwvcy7Gmyg,Altcoin Buzz,2022-05-09T15:56:46Z,Get $124 for signing up with MEXC Exchange (FREE $25 in your MEXC wallet + 1-month ALTCOIN BUZZ ACCESS PRO ...
CSyeBVppRm0,"Polkadot DOT Price News Today - Technical Analysis Update Now, Price Now! Elliott Wave Analysis!",UCngIhBkikUe6e7tZTjpKK7Q,More Crypto Online,2022-06-24T19:15:00Z,"Polkadot DOT Price News Today - Technical Analysis Update Now, Price Now! Elliott Wave Analysis! In this video I talk about a ..."
RJa9XhBpssA,POLKADOT TO $6? Don&#39;t Miss This DOT Opportunity!,UCviqt5aaucA1jP3qFmorZLQ,Crypto Jebb,2022-05-12T18:00:10Z,"In this Polkadot Technical Analysis video, we discuss why Polkadot may retrace all the way down to $6, then bottom, and why that ..."
LAkRuQyK984,"Polkadot (DOT) - Análise de hoje, 27/06/2022! #Polkadot #DOT #ETH #Ethereum #BTC #bitcoin #XRP",UCY3HJfADCXTiF9kMGH5zrMg,Trade with Renato Ulianov,2022-06-27T16:27:13Z,ASSINE AGORA Club ORO (R$300/mês): https://pay.kiwify.com.br/9QfSuK3 COMPRE 'Curso de Análise Técnica RENATO ...
-avBxG3u0ik,Polkadot&#39;s Gavin Wood on Building a Layer 0 to Underpin the Entire Blockchain-Based Economy,UCL0J4MLEdLP0-UyLu0hCktg,"DeFi, NFT & Web3 Insights - The Defiant",2022-02-28T20:00:01Z,This week on The Defiant Podcast we speak to Gavin Wood. Gavin's crypto journey started with Ethereum – he was one of the ...
hzoLa1mNC8g,Solana vs Polkadot vs Ethereum 2.0 (Which is BEST?),UCxdWHEhEPiYhCADMrn4PdhQ,Fin Tek,2021-12-27T22:15:01Z,Which Gen 3 blockchain is the best between Solana vs Polkadot vs Ethereum 2.0? In this video I compare the three cryptos using ...
kY4Sfti5HmA,Polkadot: DOT Price Potential!! TOP 5 NEXT?? 🤔,UCqK_GSMbpiV8spgD3ZGloSw,Coin Bureau,2021-10-08T15:19:33Z,Insider Info in my Socials https://guy.coinbureau.com/socials/ Get The Hottest Crypto Deals ...
Xo6fhqbQEEk,What&#39;s Next for Polkadot?,UCxdWHEhEPiYhCADMrn4PdhQ,Fin Tek,2022-03-14T18:15:01Z,Sign up for Webull: (Get up to $9600 worth of free stock) https://act.webull.com/invite/share.html?inviteCode=PZmxRyn4PfPm ...
b86qqIDwUo4,Web 2.0 is dead. Long live Web3 | Gavin Wood at Collision Conference 2022,UC7WQaPdEJB3n-Gwo0ofN6bw,Parachains,2022-06-21T22:56:24Z,Polkadot's Gavin Wood at Collision conference on the key difference between web 2.0 and Web3 https://parachains.info is ...
C0KVtmodhJU,What is Polkadot? Polkadot Explained,UCpwUeFzkWEEduSoxpiI1UsA,Exodus,2021-01-26T15:00:10Z,"Polkadot is building the Internet of blockchains because it believes in a multichain universe, where multiple blockchains can ..."
YgXJEAN7ZOE,POLKADOT - El mejor proyecto cripto ✅ (podría explotar en cualquier momento)🤯,UCZcMmHOAPxtjmW2Dd4n10Bg,Más Que Criptos,2022-06-21T13:13:33Z,En este video Sergio os explica la parte técnica de Polkadot. Polkadot WorldBarcelona: ...
j-xxzTogpQQ,Polkadot vs Cardano vs Ethereum 2.0 (Which is BEST?),UCxdWHEhEPiYhCADMrn4PdhQ,Fin Tek,2021-10-11T21:15:06Z,Which Gen 3 blockchain is the best between Polkadot vs Cardano vs Ethereum 2.0? In this video I compare the three cryptos ...
SGyc0e7AKqI,Polkadot (DOT) Crypto Explained In 2022!,UC-OTgwOAI7KmP0eDAtqN3Ow,CoinGecko,2022-06-22T10:29:33Z,"Polkadot enables cross-blockchain transfers of any type of data or asset, not just tokens. Connecting to Polkadot gives you the ..."
A_vZQzjjuGU,POLKADOT: DOT FUNDAMENTAL ANALYSIS &amp; PRICE PREDICTION IN HINDI - Polkadot Cryptocurrency Explained,UCRzdYjloQI7VJYax6GsX8ZQ,Shivam Chhuneja,2021-07-04T15:00:32Z,Get my course on Blockchain & Bitcoin Fundamentals on Udemy: https://bit.ly/blockchainshivam #polkadot #kusama ...
kH1xXeinINY,Polkadot vs Cosmos: Who Wins? 🤔,UCi7egjf0JDHuhznWugXq4hA,Coinsider,2022-02-09T16:00:33Z,Polkadot and Cosmos are two of the biggest blockchain interoperability projects. But which one is better? Because we have ...
jPcJQTlR9No,"Polkadot DOT Price News Today - Technical Analysis Update Now, Price Now! Elliott Wave Analysis!",UCngIhBkikUe6e7tZTjpKK7Q,More Crypto Online,2022-06-16T06:30:06Z,"Polkadot DOT Price News Today - Technical Analysis Update Now, Price Now! Elliott Wave Analysis! In this video I talk about a ..."
o7dhr8C7qPI,"Getting to know Gavin Wood: The visionary behind Ethereum, Polkadot and Web 3.0 - CfC St Moritz 2022",UClExpOgMY52pOc3OWGkXoeg,CfC St. Moritz,2022-02-01T16:05:05Z,Gavin Wood is the CTO and Co-Founder of two of the blockchain's biggest successes: Ethereum and Polkadot. Every interview ...
Iatr0xiFfbc,Debes Saber ESTO Sobre POLKADOT,UCno35IUSUwiJ676J4kdqS6Q,Cripto Fortunas,2022-04-24T23:45:00Z,Debes Saber ESTO Sobre POLKADOT ▭▭▭▭▭▭▭▭▭▭▭▭▭▭▭▭▭▭ Redes Sociales Cripto Fortunas Instagram: ...
F3gXlM-zMmk,Polkadot Crypto Token Price Prediction (Crash Price Targets Revealed),UCbmx_RjElY1E_dlY_N-n1Ag,cosasverdes,2022-06-22T13:54:41Z,Polkadot Price Prediction video. Watch this video about Polkadot Price analysis shows you EXACTLY how and why to interpret ...
NMa6DYhBWkc,Polkadot Kurs Prognose - Kaufen o. Verkaufen - DOT Technische Elliott Wellen Analyse,UCm62Fc-KLhthnendjDBeUyw,Schulz & Team Analytik,2022-06-28T07:44:06Z,Die Schulz & Team Analytik analysiert Kursziele des Bitcoin und anderer Kryptowährungen. In diesem Video behandelt ...
Uo236FwBLao,Что такое Polkadot? Объясняем за 5 минут! (ПростоКрипта),UCvZLuvjw2NsGY5y1EtpR4aw,Incrypted,2021-11-23T13:20:47Z,Наш Telegram: https://t.me/incrypted Наш чат: https://t.me/incrypted_chat Twitter: https://twitter.com/incrypted Instagram: ...
OhLbK3jgpjc,Polkadot的厲害之處究竟在哪兒？ 10分鐘影片帶你認識DOT,UCeXxT_PoNOzS5dMOmmNk-6A,堆金積玉,2022-01-06T11:00:11Z,免費加入堆金積玉交流社區：https://community.goldenrichacademy.com 免費下載《30天自律 ...
3yLx3uiBj44,POLKADOT DOT 💥 ESTOU COMPRANDO MAIS! 👉 ANÁLISE TÉCNICA/GRÁFICA DE HOJE 📈📉,UCMBBoohAXpzBu_UpJ6cQUuw,Adriano Invest,2022-06-20T13:00:02Z,Análise técnica/gráfica de hoje da Polkadot DOT com a projeção de preço para esta criptomoeda. Você acha que vale a pena ...
