id,title,channel_id,channel_name,published_date,description
YyyBMls7Tp4,🚨NEXT MOVE FOR BITCOIN AND ETHEREUM!? (Live Analysis),UCNHz224-6zLSFgMUju__wwQ,Andy Bitcoinsensus,2022-06-28T09:47:37Z,Bybit: https://www.bitcoinsensus.com/bybit Up to $4'450 in Bonus + 0% Maker Fee for 30 days Phemex: ...
wf5CgWX432o,BUYING 21 BITCOIN RIGHT NOW !!!!,UCtR_Pn4XLjLU53LhRqYrJTQ,James Crypto Guru,2022-06-28T09:16:52Z,"In this video I'm doing BTC technical analysis, trading on Bybit, showing my Bitcoin strategy, sharing my thoughts about Bitcoin ..."
vs3PNdfsayU,BITCOIN ON-CHAIN SURPRISE!!!!!,UCu7Sre5A1NMV8J3s2FhluCw,Crypto Love,2022-06-28T11:00:29Z,BITCOIN IS ABOUT TO SURPRISE THE ENTIRE CRYPTOCURRENCY MARKET!!!!! EVERYONE IS LOOKING FOR BITCOIN ...
17qWuTJSgvE,Bitcoin BTC Price News Today - Technical Analysis and Elliott Wave Analysis and Price Prediction!,UCngIhBkikUe6e7tZTjpKK7Q,More Crypto Online,2022-06-28T11:18:23Z,Bitcoin BTC Price News Today - Technical Analysis and Elliott Wave Analysis and Price Prediction! In this video I talk about the ...
OZrUiIzr9xc,⚠️ ALERT!!!!! THIS BITCOIN MOVE IS A TRAP!?,UCY7zYMsiIAA_sP1mY--I23Q,Crypto Anup,2022-06-28T09:44:19Z,ALERT!!!!! THIS BITCOIN MOVE IS A TRAP!? FREE $5150 CRYPTO EXCHANGE BONUS   FREE $4100 PHEMEX BONUS ...
2_TK1Go8clQ,We&#39;re Heading To $0 | Explained,UCGy7SkBjcIAgTiwkXEtPnYg,Andrei Jikh,2022-06-27T22:15:00Z,Explaining how crypto and Bitcoin is all headed to $0: ▻ Skip the waitlist and invest in blue-chip art for the very first time by ...
auluNnlkn5E,"Bitcoin Price May Get Boost Then Plummet Down to $12K, Says Trader Who Predicted Crash",UCVgL_VeHteGecp5nn0NRztQ,Stansberry Research,2022-06-27T21:16:42Z,"""I have a [bitcoin] target around $12000,"" says technical trader Gareth Soloway, president and CFO of InTheMoneyStocks.com."
kjws7qWzZuk,SEC DECLARE ETHEREUM A SECURITY? | BITCOIN &amp; CRYPTO UPDATE,UCI7M65p3A-D3P4v5qW8POxQ,CryptosRUs,2022-06-28T02:23:35Z,Today let's talk about what SEC Chair Gary Gensler said about Bitcoin and what he didn't say about Ethereum. Also an update on ...
yscO4H0KrTw,Bitcoin: Make $100/Day Trading Crypto In 3 Steps!,UCz2wzs4KacqHth7R_N5grgA,Michael Pizzino,2022-06-28T04:57:58Z,ByBit Exclusive: Up To $4450 Sign Up Bonus → https://partner.bybit.com/b/pizza ByBit “World Series Of Trading” ...
lsFnlo5wmG0,#BİTCOİN SON DURUM NEDİR ? YÜKSELİŞ DEVAM EDECEK Mİ   ?  #KRİPTOPARA,UCjn0F2sP60grcYlUTwpaPJA,Coin Servisi,2022-06-28T00:56:31Z,bitcoin ve altcoinlerin genel teknik analizlerini gerçekleştirdiğimiz canlı yayında bitcoinin hangi seviyelerin üzerinde konsalide ...
QATRK7EaykU,🚨BITCOIN DROP!!! NOW WHAT? (watch here..),UCNHz224-6zLSFgMUju__wwQ,Andy Bitcoinsensus,2022-06-27T18:23:26Z,Bybit: https://www.bitcoinsensus.com/bybit Up to $4'450 in Bonus + 0% Maker Fee for 30 days Phemex: ...
ukUnVY3fzfo,Bitcoin Hoy 🗣 ¿Habrá DECISIONES CLAVE? 🔝 Detalles IMPORTANTES Sobre la DOMINANCIA de BTC,UCKP8me8NRKaGZZHAuKSSuvA,Alex Ruiz,2022-06-28T11:06:51Z,La DOMINANCIA parece estar en CORRECCIÓN después de confirmar la TENDENCIA ALCISTA... Mira este DETALLE sobre la ...
bZkDordiRBY,END OF THE ROAD FOR BITCOIN!?!?!? BTC + Crypto Price Prediction Analysis w/ @MDX Crypto,UCVIOA9XqMtMUk8U-IF-dSYA,Sami Loyal - Forflies,2022-06-27T15:02:35Z,"This Bitcoin and Cryptocurrency trading analysis applies to various exchanges, including Bybit and Binance. Tackling questions ..."
GP2UsiPPTJk,Breaking: SEC Confirms Bitcoin Is Not A Security!,UCevXpeL8cNyAnww-NqJ4m2w,Anthony Pompliano,2022-06-27T20:15:01Z,"Use Bitcoin and other altcoins to bet on sports, casino games, horse racing, poker and more at BetOnline.ag. Using crypto at ..."
QDsw5yIsEJc,MARKET MAKERS - BITCOIN MONEY FLOW,UCf4I6aYT3E9jcEmP1Ax1ctQ,Market Makers,2022-06-28T01:56:08Z,"TELEGRAM SIGNALS GROUP SIGN UP - CLICK OUR LINK, SEND A MESSAGE http://t.me/marketmakersdm JOIN SimpleFX ..."
OQG-zSJGOD0,Bitcoin BTC Price News Today - Technical Analysis and Elliott Wave Analysis and Price Prediction!,UCngIhBkikUe6e7tZTjpKK7Q,More Crypto Online,2022-06-28T06:12:08Z,Bitcoin BTC Price News Today - Technical Analysis and Elliott Wave Analysis and Price Prediction! In this video I talk about the ...
gXJPmV38Y6M,BITCOIN &amp; $DOGE WATCH THIS WITHIN 24 HOURS !!!!!!,UCtR_Pn4XLjLU53LhRqYrJTQ,James Crypto Guru,2022-06-27T11:25:34Z,"In this video I'm doing BTC technical analysis, trading on Bybit, showing my Bitcoin strategy, sharing my thoughts about Bitcoin ..."
etJiB8K2JcM,Analiza Bitcoina Poniedziałek Tradera Radosław Rygielski 27.06.2022,UCQpBmjL9kJ768fty4tbqa6Q,Phil Konieczny,2022-06-27T19:54:30Z,KANGA Anonimowa giełda bez KYC Link z 15% zniżką fee: https://trade.kanga.exchange/auth/register/?
IB5r0N6GHMk,BITCOIN EILMELDUNG! WO IST DER BODEN 🤔 DAMIT MUSST DU RECHNEN (wichtige Charts...) | Crypto News,UC_y6R-yvA_Hw82jhVycgifg,TestWerk,2022-06-28T08:23:28Z,15% extra auf alle Einzahlungen   Margex*: https://margex.com/?rid=38979168 Promocode: TWERK15 Hier geht es zu ...
Gm8PmMU8Lhc,La Météo Bitcoin FR - Mardi 28 juin 2022 - Analyse Crypto Fanta,UCz8MkF5U6HeqLwsGBzTxQ3w,Crypto Fanta,2022-06-28T07:17:27Z,Voici la Météo du Bitcoin extraite de mon Live Pédagogique VIP. Ma formation gratuite : https://cours.tradingcrypto.fr/ Je suis sur ...
x71LYM7pxsU,🚨 WARNING!!!!! THIS WILL BE REALLY BAD FOR BITCOIN!!! INSTITUTIONS ARE AFTER YOUR MONEY!,UCNvJ5QckHYb3CeRBbbZry-A,AMCrypto,2022-06-27T16:56:59Z,In todays episode i show you exactly what i had warned off the recent days and what i expect from the market to do next!!!! Watch ...
l_AlUOqLEJ4,WATCH FOR BITCOIN TO CORRECT TO THIS PRICE THIS WEEK (OVERBOUGHT SIGNS PRESENT),UC9hY-bLKEdD5gfKtAzWlueA,Trade Confident,2022-06-27T14:41:44Z,"In this video, I'll show you my Bitcoin price prediction of why we could be seeing a reversal back down this week to a specific price ..."
tQD1Citge4I,😱PRONTO Bitcoin 4k |Ethereum  300$😱 NOTICIAS CRIPTOMONEDAS (HOY) Resumen criptomonedas noticias hoy✅,UCRsX3QOyl9RigIoN_UKqDlA,OriDigital,2022-06-28T03:07:45Z,"️EL MERCADO NO HABÍA CAÍDO AHORA SI VA A CAER EN PICADA   ️, Noticias criptomonedas HOY✓ no te pierdas las ..."
lPoNiT6dRAc,AS ALTCOINS AO INVÊS DE AJUDAR A CHEGAR NO MILHÃO PODEM TE ATRAPALHAR | AUGUSTO BACKES,UCOTEA2tMLMhfssnqOoI7Qrw,Cortes Augusto Backes [OFICIAL],2022-06-27T22:52:46Z,CURSO MESTRES DO BITCOIN 3.0 (CUPOM 55%: BEARMARKET ) ○ LINK PROMOCIONAL: http://bit.ly/3xy15Ty ○ TORNE-SE ...
_X1PdvxTmZk,🚨ALGO ENORME VA A SUCEDER ✅Análisis Criptomonedas (HOY) CARDANO | BITCOIN | ETHEREUM | SOLANA,UCccJ73p62TFlX1ImgWEdp4g,Informe Crypto,2022-06-27T22:00:22Z,El PRECIO de BITCOIN y las CRIPTOMONEDAS pueden SUBIR! ¿El DINERO INTELIGENTE va a PROVOCAR una CAÍDA para ...
9YDYlDZwC34,BITCOIN: SERÁ ESSA ÚLTIMA OPORTUNIDADE DE COMPRA? | Bitcoin Hoje - Análise Bitcoin (BTC),UCNtUQg0IkD-gVcGc34lhuTA,Investidor Modesto,2022-06-27T21:21:16Z,"Análise técnica do Bitcoin Hoje: dia 27/06/2022, Bitcoin (BTC) segue evoluindo para uma tendência lateral enquanto temos cada ..."
yh3HOgLUVLQ,&quot;Grab this Bounce if it happens!&quot; | Gareth Soloway Bitcoin Price Prediction,UCrUErmepJxHL6gyvZ-KRHNQ,The Daily Crypto,2022-06-27T17:18:55Z,"""Grab this Bounce if it happens!"" | Gareth Soloway Bitcoin Price Prediction In this video, Gareth Soloway will do a new Bitcoin ..."
ol7mdUEdWaA,Caution Bitcoin TRAP: Crypto Trading in MAJOR Economic “Reset”,UCIb34uXDsfTq4PJKW0eztkA,Jason Pizzino,2022-06-28T02:26:17Z,Free $4450 ByBit Deposit Bonus if using this Link → https://partner.bybit.com/b/pizza ByBit World Series Of Trading with “Crypto ...
Rz1_E6QKXVI,Inflation’s Hidden Cost with Avik Roy,UCzrWKkFIRS0kjZf7x24GdGg,What Bitcoin Did,2022-06-27T12:29:23Z,SHOW NOTES: https://www.whatbitcoindid.com/podcast/inflations-hidden-cost Avik Roy is president of the Foundation for ...
w_fj0ZNE0Pw,🚀Buy OR 🚨Sell Crypto Today? (Bitcoin Price &amp; Altcoin Market Update),UCybasP-2D2b5kTLAb_kvhWQ,Crypto Shorts!,2022-06-27T09:58:37Z,"The Bitcoin Price is moving into a more and more narrow space with declining volume, this indicates that a bigger move should be ..."
bSHS7J4gj-8,Bitcoin Bottom Coming Soon! Capitulation Soon! Likely Near the 300 Week MA At The 16K Area,UC7AQQ3I02_5D6uShK96MeiA,The Crypto Trader,2022-06-28T02:30:38Z,"Thank you for taking the time to watch. If you want to support these videos, you can do so by following this link. Tips and Donations ..."
FNJH-ATc3PU,Michael Saylor: Regulation Is Great For Bitcoin.,UCevXpeL8cNyAnww-NqJ4m2w,Anthony Pompliano,2022-06-27T13:00:08Z,Subscribe to the NEW Best Business Show Live Channel. This channel will be only be clips from the show only going forward ...
tvNJFwDw4HE,#BİTCOİN DE SİNYALLER AL VERSEDE AYI TUZAĞI VE SİLKELEMERE DİKKAT   Btc Teknik Analiz,UCekYuUN1kfynFyjY4ukkzTg,Uzman Teknik Analiz,2022-06-28T09:22:10Z,İnstagramda Sinyal Grubu için daha kısa sürede dönüş yapabilirim. https://www.instagram.com/uzmanteknikanaliz/ İkinci Kanalım ...
DHt1PRu8jfo,🚨This Has NEVER Happened Before With Bitcoin! (Is Everything About To Change?),UCN9Nj4tjXbVTLYWN0EKly_Q,Crypto Banter,2022-06-27T15:24:54Z,The Bitcoin price and the Altcoin markets have been showing strength over the past few days and it's time to make a decision.
oTa_3W8rMno,SEC Chair Gary Gensler discusses potential crypto regulation and stablecoins,UCrp_UI8XtuYfpiqluWLD7Lw,CNBC Television,2022-06-27T15:13:50Z,"SEC Chair Gary Gensler sits down with the 'Squawk on the Street' team to discuss potential regulation over cryptocurrencies, ..."
9VEg2_yGSlE,🚨¿QUE ESTA PASANDO CON BITCOIN?🚨¡Las fuerzas ALCISTAS y BAJISTAS rivalizan intensamente!⚡📊,UCh6QX-MKZvfTFn-A2g9J6Ug,OHANA DIGITAL,2022-06-28T09:00:05Z,Quieres ser un profesional de las criptomonedas y DeFi? Ohana Valhalla https://ohanavalhalla.com/ ✓ Registro Bitget: ...
l79rTf60UBQ,"Altcoin Market Gets First Green Week, Bitcoin Market Cap Price Chart Holds All Time High, Conflicts",UCia6oYbLKo8fLOguATpACmA,Blockchain Backer,2022-06-27T16:09:02Z,Linqto - Private Investing Made Simple - http://bit.ly/Linqto-BlockchainBacker Where accredited investors can invest in companies ...
nj9SnL9ndiI,Bitcoin Is Just BETTER,UC-5HLi3buMzdxjdTdic3Aig,The Modern Investor,2022-06-27T09:45:02Z,Protect And Store Your Crypto With A Ledger Nano: https://www.ledger.com?r=8af3ed38d3b7 ------------------------------------------- I ...
6Zkg-k-DVIU,BITCOIN NEWS LIVE 🚨 HOW BAD CAN THIS GET?!,UCytNzxSmUqEBychgoKoQssw,That Martini Guy,2022-06-27T20:18:13Z,BREAKING BITCOIN NEWS. CRYPTO NEWS & ON CHAIN INDICATORS! Instructions to join World Series of Trading 2022 ...
hlgKrk-2rWA,$28 MILLION REKT ON BITCOIN!!!! [shocking truth] BITCOIN PRICE PREDICTION 2022 // BITCOIN NEWS TODAY,UCVEQTVuaFpcatHDhKIyhZmQ,BitcoinHyper,2022-06-28T10:57:57Z,Bitcoin News Today - $28 MILLION REKT ON BITCOIN!!!! [shocking truth] BITCOIN PRICE PREDICTION 2022 // BITCOIN NEWS ...
TOa2dKdd9H0,&quot;It didn&#39;t even start yet!&quot; | Gareth Soloway Bitcoin Price Prediction,UCrUErmepJxHL6gyvZ-KRHNQ,The Daily Crypto,2022-06-27T20:15:51Z,"""It didn't even start yet!"" | Gareth Soloway Bitcoin Price Prediction In this video, Gareth Soloway will do a new Bitcoin price ..."
WAzUb5dyU48,HUGE SIGNAL FLASHING SOON (Prepare Now)!! Bitcoin News Today &amp; Ethereum Price Prediction (BTC &amp; ETH),UCgY66N1YS_G9lYMvCQko6yw,Crypto World,2022-06-27T22:33:43Z,HUGE SIGNAL FLASHING SOON (Prepare Now)!! Bitcoin News Today & Ethereum Price Prediction (BTC & ETH) Welcome back ...
b_-tT-eL41g,Wall Street To Bail Out Crypto? Bitcoin &amp; Ethereum Recovery,UCxIU1RFIdDpvA8VOITswQ1A,Scott Melker,2022-06-27T14:16:58Z,"Special guest: Josh Olszewicz, head of research at Valkyrie Sponsored by Vauld. Sign up here http://thewolfofallstreets.info/vauld ..."
6sH5ZGVkdTg,BITCOIN LIVE: Can Price Hold Up?,UCTjmbErMbPlSr6bbju-4Wdw,Jordan Camirand Crypto,2022-06-28T00:58:42Z,Become a Channel Member - https://bit.ly/2Wjnbw9 Buy and Trade Crypto on these Exchanges! --- ✓ Kucoin ...
RkLWbpt9Z-s,BITCOIN: BOTTOM IS IN?!,UCNc4FB7ylWM0LBx0rx8SyZA,Crypto Dubai ,2022-06-27T13:55:54Z,Bybit $4460 Bonus AND 30% Trading Fee Discounts Here:⚡ Bybit: https://partner.bybit.com/b/cryptodubai Join the Patreon: ...
XE01M8FJoc0,BITCOIN HOLDERS...BRACE FOR THIS WEEK!,UCI7M65p3A-D3P4v5qW8POxQ,CryptosRUs,2022-06-27T14:13:38Z,"Today let's talk about Bitcoin and why it may have a big week. Also big updates in regards to several crypto companies, Nexo, ..."
lInjQYyG6dc,⚠️ BIG DANGER FOR BITCOIN TODAY!!!! ⚠️,UCc4Rz_T9Sb1w5rqqo9pL1Og,The Moon,2022-06-28T09:33:27Z,Up to $4500 Bybit BONUS: http://bit.ly/MoonBybit Get the BONUS & 0% Maker Fees for 30 Days if you sign up with the link above!
Qz7irV8NotA,"BITCOIN, CRYPTO, STOCK MARKET UPDATE!!! This time is different!",UCFrYIWkwYECFeV3ppNwcvag,Greg Dickerson,2022-06-27T17:50:13Z,Here's how I can help you: Courses https://www.dickersoninternational.com/courses?el=realestate One on one Coaching ...
OtCZ4x72qhg,FORMER CRYPTO BILLIONAIRE INSIST BITCOIN WILL SOAR TO $250K WITHIN NEXT 18 MONTHS!!,UCeZ_fkLGty1SX1Dop-uCEEw,Crypto News Alerts,2022-06-27T16:06:11Z,Venture capitalist Tim Draper thinks Bitcoin is going to go up more than 10-fold by the end of 2023. He isn't the only crypto mogul ...
qIUjvXENB08,Bitcoin Is Superior To Crypto In Every Way: Mark Moss,UCevXpeL8cNyAnww-NqJ4m2w,Anthony Pompliano,2022-06-27T21:40:25Z,Subscribe to the NEW Best Business Show Live Channel. This channel will be only be clips from the show only going forward ...
