id,title,channel_id,channel_name,published_date,description
s3xlXiH88fM,WTF...MORE STIMULUS CHECKS COMING | BITCOIN UPDATE,UCI7M65p3A-D3P4v5qW8POxQ,CryptosRUs,2022-06-29T02:37:47Z,Today I want to talk about all the reasons to buy Bitcoin right now and talk about the state of the economy. Plus California is about ...
3nSiadJg8So,WHAT’S HAPPENING WITH CRYPTOCURRENCY? (GOLDMAN SACHS SAYS SELL!),UCbLhGKVY-bJPcawebgtNfbw,Altcoin Daily,2022-06-29T00:21:25Z,"What's happening with cryptocurrency into July 2022? Let's discuss the LATEST cryptocurrency news for bitcoin, ethereum, ..."
MPpflSVD89w,EXPECT THIS BIG BITCOIN MOVE IN THE NEXT 72 HOURS...[Watch Before July 1st],UCGDjpwZV-bU-sLSnhInCfKQ,Satoshi Stacker,2022-06-28T09:26:05Z,TRADE WITH ME ON BYBIT - WSOT: https://bit.ly/3xCdkBH UP TO IN $9030 BONUSES BELOW! ~~~~~ Top 2 Trading Platforms: ...
onDC8IRjOag,BEAR MARKET ISN’T OVER (Industry Pivots Suggest A LONG-HAUL For CRYPTO Losses),UCjemQfjaXAzA-95RKoy9n_g,BitBoy Crypto,2022-06-28T21:44:11Z,"Around the Blockchain is your favorite Cryptocurrency show discussing Bitcoin, Ethereum, Cardano, and the top altcoins. Our four ..."
8oVwGsOtjfw,⚠️URGENT!!!!⚠️BITCOIN IS SETUP FOR DISASTER!!!! 😰⚠️Crypto Prediction TA &amp; Cryptocurrency News Today,UCOaew10hdmtfa0MinTjOBqg,Crypto Kirby Trading,2022-06-28T19:31:58Z,Join my VIP now! - https://t.me/joinchat/rkXuLgtoTWQyY2M5 Bitcoin Price Dump / Crash Analysis & Crypto News Update!
rYQgy8QDEBI,How Cryptocurrency ACTUALLY works.,UCMiJRAwDNSNzuYeN2uWa0pA,Mrwhosetheboss,2021-06-06T11:15:56Z,"Bitcoin, Dogecoin, Ethereum, NFT's, all explained in one simple guide! Do consider subscribing if you enjoyed! It would make my ..."
yfdXrqVXVv0,CRYPTOCURRENCY MARKET PRICE PREDICTION,UCHQv-nQ2caXVvtTFa8WOJRA,Alexander Lorenzo,2022-06-28T19:31:32Z,The cryptocurrency market will look very bad soon***** How To QUIT Your Job With Crypto (Step By Step)   ...
8GXknjZpko8,BITCOIN HOLDERS LOOK AT THIS METRIC,UCI7M65p3A-D3P4v5qW8POxQ,CryptosRUs,2022-06-28T14:05:04Z,Today let's talk about some important metrics for Bitcoin and talk about if the US economy is in recession. Also update on several ...
_YuoIwgWKJw,I&#39;d Sell ALL Of THIS Crypto Right Now! FTX Buying Robinhood?,UCUr_YzOB7pp50F4r1KJ7Dag,My Financial Friend,2022-06-27T20:18:47Z,Get $10 when you trade your first $100 and save 10% on fees with the links below! FTX US Exchange (Advanced): ...
kjws7qWzZuk,SEC DECLARE ETHEREUM A SECURITY? | BITCOIN &amp; CRYPTO UPDATE,UCI7M65p3A-D3P4v5qW8POxQ,CryptosRUs,2022-06-28T02:23:35Z,Today let's talk about what SEC Chair Gary Gensler said about Bitcoin and what he didn't say about Ethereum. Also an update on ...
2_TK1Go8clQ,We&#39;re Heading To $0 | Explained,UCGy7SkBjcIAgTiwkXEtPnYg,Andrei Jikh,2022-06-27T22:15:00Z,Explaining how crypto and Bitcoin is all headed to $0: ▻ Skip the waitlist and invest in blue-chip art for the very first time by ...
JgzTgBcyLlU,Crypto Questions &amp; Answers | How to be safe from Crypto Scammers | Cryptocurrency,UCYdeu_7BFLqqBBl78rOo7Zw,Mayank Kharayat,2022-06-28T15:00:10Z,"Cryptocurrency #Crypto #Q&A If you are a beginner in Cryptocurrency you must have many questions, here we try to answer all ..."
VYWc9dFqROI,Explain Crypto To COMPLETE Beginners: My Guide!!👨‍🏫,UCqK_GSMbpiV8spgD3ZGloSw,Coin Bureau,2021-06-08T15:53:24Z,Insider Info in my Socials https://guy.coinbureau.com/socials/ 20% Binance Discount https://guy.coinbureau.com/binance/ ...
Dp_AjJd-AB4,#lunaclassic 151% 🚀⏱🌜#terraclassic #lunacoin #lunac #crypto #cryptocurrency #criptovalute #shorts,UCDDJOB062didL9BjcfJzYwQ,TG Crypto info,2022-06-29T08:58:11Z,
42IuADRr51E,MAJOR BITCOIN WARNING!! CAPITULATION IS COMING….,UCHop-jpf-huVT1IYw79ymPw,Chico Crypto,2022-06-28T15:02:05Z,WARNING!! A massive bitcoin capitulation & de-leverage event is coming!! Bitcoin will CRASH!! Crypto lending platforms and ...
XE01M8FJoc0,BITCOIN HOLDERS...BRACE FOR THIS WEEK!,UCI7M65p3A-D3P4v5qW8POxQ,CryptosRUs,2022-06-27T14:13:38Z,"Today let's talk about Bitcoin and why it may have a big week. Also big updates in regards to several crypto companies, Nexo, ..."
89b6Pz1tLs8,Terra Luna News Today | Rajeev Anand | Crypto News Today | Cryptocurrency News Today | Luna Classic,UCwJDtu7QF1-XcHiwelBo0NQ,Crypto Marg,2022-06-28T12:30:11Z,Luna Classic News| Luna Update | luna classic news | ust | luna news | luna news today (Crypto Marg Community) For Learning ...
P0eRJQhXRRw,The Whole Crypto Market is in Danger of Collapsing (Altcoins May Get Crushed),UCbLhGKVY-bJPcawebgtNfbw,Altcoin Daily,2022-06-26T22:29:32Z,"Will The Fed keep raising rates? Bitcoin or altcoins in 2022? Let's discuss the LATEST cryptocurrency news for bitcoin, ethereum, ..."
1YyAzVmP9xQ,Cryptocurrency In 5 Minutes | Cryptocurrency Explained | What Is Cryptocurrency? | Simplilearn,UCsvqVGtbbyHaMoevxPAq9Fg,Simplilearn,2021-06-29T15:30:00Z,This video on Cryptocurrency covers all the important concepts from basics to advanced. Also it covers all the information about ...
Yb6825iv0Vk,How To Invest In Crypto Full Beginners Guide in 2022,UCQglaVhGOBI0BR5S6IJnQPg,Brian Jung,2021-01-07T01:41:59Z,This is the ULTIMATE Guide on how to get started in cryptocurrency investing for beginners. **OPEN ME** for all the resources ...
0KYzYZGgLo8,P2P ചെയ്യുമ്പോള്‍ ഇതെല്ലാം  ശ്രദ്ധിയ്ക്കുക !!! | Cryptocurrency Malayalam ❤️ | Wall Street 🔥,UC52ruVNZpHpztTqz7O4JemQ,Wall Street,2022-06-28T13:15:00Z,Join Our Community ❤️ https://bit.ly/3AM9Uwf Read Wazirx P2P Blog ...
7FhHUX0AGpg,DON&#39;T BUY THESE CRYPTO COINS IN BEAR MARKET!,UCl2oCaw8hdR_kbqyqd2klIA,Lark Davis,2022-06-26T13:00:02Z,"Do not buy these crypto altcoins in Bitcoin crash! [Lark Davis Crypto News] BYBIT $100 FREE, 30% OFF & $4100 BONUS ..."
sR4sw4o_VJQ,BITCOIN READY FOR A BIG WEEK | FTX TAKING OVER BLOCKFI?,UCI7M65p3A-D3P4v5qW8POxQ,CryptosRUs,2022-06-26T17:35:23Z,"Today let's talk about Bitcoin and why it is ready for a big week. Also big updates on Blockfi, FTX, Harmony, Sandbox, Avalanche ..."
0PlLvqSajYI,XRP Bounce From $0.30?,UCiuD3eNaZ95eSXImp_eSIww,Tom Crown,2022-06-29T09:00:01Z,XRP Bounce From $0.30? CHANNEL PARTNERS Market Cipher Use Code Crown ➡️ https://tcrown.me/MarketCipher Phemex ...
K-HadTlab9g,AVOID FOMO AT ALL COSTS!!! THE BEAR MARKET STRATEGY YOU MUST SEE!,UCMtJYS0PrtiUwlk6zjGDEMA,EllioTrades Crypto,2022-06-25T00:05:25Z,Follow EllioTrades on Twitter: https://twitter.com/elliotrades ✓ Sign Up for the Free Daily Newsletter: https://www.elliotrades.xyz ...
mQvw5JXXnrQ,The Ultimate Cryptocurrency Trading Course for Beginners,UCIEvlRpHBVFthrF6pZzBEXw,MoneyZG,2021-05-06T16:00:31Z,Ultimate cryptocurrency trading course tutorial for beginners. Go from beginner to confident crypto trader. How to trade ...
hNrt8yDSs8A,Best Coins to Buy Today | Which Crypto to Buy Now | Best Cryptocurrency to invest in 2022 #altcoins,UCjjkM4XUs1fyTsyqHnu7gZQ,Trading Career,2022-06-28T04:22:49Z,"Bitcoin crash, Bitcoin News, Bitcoin update TRADE BITCOIN WITH 1000$ BONUSES FREE BELOW!!! Best Crypto Exchanges ..."
ZTT_47tZP-w,Easiest Way To Start Investing In Crypto in 2022 (Exactly What I Did),UCCREZW4tPMBzzDWxCIdmEyA,C Rich,2021-09-10T13:30:16Z,"This is the easiest way to start investing in crypto for beginners in 2022! In this video, I share the exact strategy I used to start a ..."
2AdlI_jaZ40,HAVE YOU READ THIS Crypto Bill!? Regulations Incoming!?,UCqK_GSMbpiV8spgD3ZGloSw,Coin Bureau,2022-06-25T15:11:46Z,Get The Hottest Crypto Deals https://guy.coinbureau.com/deals/ Insider Info in my Socials ...
7PGt28X4ufU,"Bitcoin, Cryptocurrency &amp; Blockchain: What&#39;s driving the craze?",UC_gUM8rL-Lrg6O3adPW9K1g,WION,2021-04-25T14:30:12Z,Why is #DogeCoinToTheMoon trending? What is #BitcoinCrash? What's driving the whole crypto craze? Is it worth investing your ...
e0MG6n95iw8,The Crypto Bailout Just Started - BEWARE,UCGy7SkBjcIAgTiwkXEtPnYg,Andrei Jikh,2022-06-24T22:33:14Z,"The crypto bailout explained - how to stay safe investing right now: ▻ Discover the power of social investing with stocks, ETFs ..."
faHzCXaGH8U,CRYPTO INVESTORS WATCH OUT THIS WEEKEND,UCQglaVhGOBI0BR5S6IJnQPg,Brian Jung,2022-06-24T18:39:46Z,Invest in Crypto 24/7 with Your IRA https://itrust.capital/brianjung Join Our Crypto Community Here: ...
wSPuWFSFgFQ,Is Bitcoin Dead? They Don’t Want You To Know This Crypto Holders,UCl2oCaw8hdR_kbqyqd2klIA,Lark Davis,2022-06-25T13:00:36Z,"Bitcoin Dead, don't want crypto holders to know! [Lark Davis Crypto News] BYBIT $100 FREE, 30% OFF & $4100 BONUS ..."
ihWJrlM-TdQ,Was This The Crypto BOTTOM?! Are We Heading LOWER?! 📉,UCqK_GSMbpiV8spgD3ZGloSw,Coin Bureau,2022-06-26T14:13:53Z,Get The Hottest Crypto Deals https://guy.coinbureau.com/deals/ Insider Info in my Socials ...
Jd4OMvXJiZI,HEAVY REGULATION is COMING to CRYPTO SOON [SEC CHAIR WARNS] + GRAYSCALE BITCOIN ETF JULY 6TH,UCbLhGKVY-bJPcawebgtNfbw,Altcoin Daily,2022-06-27T22:44:50Z,SEC Chair Gary Gensler UPDATES Crypto Industry on Upcoming Regulations! + Grayscale Bitcoin SPOT ETF July 6th Incoming?
kvdKkP7K9YM,USTC TerraClassicUSD Big News😍| USTC Prediction | USTC cryptocurrency Latest News Hindi,UCjjkM4XUs1fyTsyqHnu7gZQ,Trading Career,2022-06-29T05:18:41Z,WHY IS #LUNA CLASSIC & #UST PUMPING? TERRA LUNA BURN UPDATE! BINANCE to BURN LUNA CLASSIC & USTC?
IbyGjT5lvbY,Pearlvine New Update Today | Pearlvine Cryptocurrency | Pearlvine International,UCB1TjFK5E9at_jgyMfzQktw,Creative CP Singh,2022-06-26T03:15:00Z,Pearlvine New Update Today | Pearlvine Cryptocurrency | Pearlvine International Hi I am Chandra Prakash Singh. Welcome to my ...
svEDVfH3JwA,Kevin OLeary - The Crypto Coins To Hold And The Ones That Will Go To Zero,UClMW7w5LIPCr98Hw17GeiYQ,Savvy Finance,2022-06-17T15:15:06Z,Kevin OLeary - The Crypto Coins To Hold And The Ones That Will Go To Zero Get Your $100 Bonus With iTrust Capital IRA ...
ibIvbqZC4m4,⚠️URGENT!!!!⚠️MASSIVE BITCOIN PRICE UPDATE!!!!⚠️Crypto Prediction TA &amp; BTC Cryptocurrency News Today,UCOaew10hdmtfa0MinTjOBqg,Crypto Kirby Trading,2022-06-26T17:51:21Z,Join my VIP now! - https://t.me/joinchat/rkXuLgtoTWQyY2M5 Bitcoin Price Dump / Crash Analysis & Crypto News Update!
epbm5MrXjjI,Cryptocurrency Bata Paisa Kamaune Nepali Chahana | How Traders Earn More Money from Crypto?,UCd-ac3z3CdHBcJwrNTfRplQ,Technical View,2022-02-02T13:25:17Z,Cryptocurrency Bata Paisa Kamaune Nepali Chahana | How Traders Earn More Money from Crypto? Friends yo video ma maile ...
tu7iR6cIqnU,This Is A Major Sign That Crypto Could Be Headed Much Lower After The Bounce,UCbnW0mcfnVBkU--SquceUQg,ClayBro,2022-06-26T15:30:06Z,Cryptocurrency mining is declining at some alarming rates as the price of crypto is making it unprofitable for many to mine bitcoin ...
Q3qmCW9RYdQ,Cryptocurrency Market Update | ADA XRP SAND VRA SHIBA | Cryptocurrency,UCYdeu_7BFLqqBBl78rOo7Zw,Mayank Kharayat,2022-06-27T11:30:08Z,"Crypto #Cryptocurrency #Marketupdate Let's discuss about the Cryptocurrency update, what is happening in different Crypto and ..."
8j8c427GUCM,BITCOIN HAS NEVER DONE THIS BEFORE…IS IT TIME TO PANIC ABOUT CRYPTOCURRENCY?,UCbLhGKVY-bJPcawebgtNfbw,Altcoin Daily,2022-06-18T20:34:29Z,"The Fed, Celsius bankruptcy, Three Arrows Capital POSSIBLY INSOLVENT! Let's discuss the LATEST cryptocurrency news for ..."
31tZeH-smz4,BITCOIN &amp; CARDANO INCH CLOSER TO RALLY...BUT BE ON HIGH ALERT FOR A BATTLE!,UCnMku7J_UtwlcSfZlIuQ3Kw,Crypto Capital Venture,2022-06-24T15:17:45Z,How To Stake Your Cardano In Minutes With Crypto Capital Venture!⬇ Stake Your ADA With Ticker: CCV1 ...
It6tzHKRmD4,The Biggest Cryptocurrency Heist (This Week),UCcKSEzhtEkzfCT8_DzyMfpg,KiraTV,2022-06-25T18:26:20Z,Install Raid for Free ✓ IOS/ANDROID/PC: https://clcr.me/DwOyh8 and get a special starter pack Available only for the next 30 ...
JZk6T1TmIrs,What is CryptoCurrency? | Everything About Bitcoin &amp; Cryptocurrencies Explained for Beginners,UCEAAzv2OBqxsSczKJ2QZyGQ,Pushkar Raj Thakur: Business Coach,2021-08-17T04:30:02Z,"In this video you will get to know everything you need to Know About Cryptocurrency, Investments in Bitcoin and Other ..."
BhYq-UIh2SM,The 5 BEST Crypto To Buy NOW June 2022 (HUGE Gains),UCMKNTbgym8h_K5IUTWwfP1A,Finance Bro,2022-06-26T16:00:10Z,"In today's video, I go over the 5 best crypto to buy now June 2022. Get A FREE Stock With Public   http://pblc.co/itsfinancebro ..."
9gzND5_Cypo,Ethereum will FLIP Bitcoin &amp; CARDANO to be #1 Crypto!,UCbLhGKVY-bJPcawebgtNfbw,Altcoin Daily,2022-06-23T19:01:26Z,"Early Bitcoin Believer Davincij15 on WHY he is betting BIG on Ethereum. Ethereum vs Cardano, Solana, etc. What is the better ..."
0uLFakqctJQ,"&quot;Everyone Is SO WRONG About This Market&quot; | Mark Cuban Reacts To Crypto, Bitcoin &amp; Ethereum Crash",UCWZg7FTpyFB9lSpk-_cVr3Q,Jamie Tree ,2022-06-16T17:00:00Z,"""Everyone Is SO WRONG About This Market"" | Mark Cuban Reacts To Crypto, Bitcoin & Ethereum Crash Earn up to $250 in ..."
omdUXcC9Pnw,BITCOIN: 🚨99% DON’T SEE THIS!!!!!!!!!!,UCBkGMys0mYl3Myxh3CTsASA,MMCrypto,2022-06-25T18:01:59Z,Did bitcoin hit bottom? Bitcoin is falling back down. I will do btc technical price analysis for Bitcoin. ~$10'000 BONUSES BELOW!
