id,title,channel_id,channel_name,published_date,description
DBkvdlAlNDY,Binance Tutorial For Beginners 2022 (FULL STEP-BY-STEP GUIDE),UCyBD3P9YOFWNIMTuDzqeObg,Collection Crypto,2021-04-14T08:32:39Z,In this binance tutorial I'll show you step-by-step how to use binance to buy bitcoin and trade cryptocurrency! Binance Referral ...
YsyueRWoa-M,How To Make Money On Binance In 2022 (For Beginners),UCYONTR6PoZVJ4EcbOz3qdtw,Mike Vestil,2020-12-20T15:00:30Z,FREE TRAINING $0 to $1k/day with crypto: http://www.mikevestil.com/binance-secret Here's how to make money on binance.
jkyBQ5zpz78,Binance Trading Full Lesson sinhala,UC7lFA9rW_EnzOyYAB8-X7-A,Sricat,2021-10-22T06:58:32Z,Helpful links Binance Register link - https://accounts.binance.com/en/register?ref=81580654 Binance Referral CODE - 81580654 ...
YzJ6xkJpeUk,Binance: Complete Beginner’s Guide + Fee DISCOUNT 📈,UCqK_GSMbpiV8spgD3ZGloSw,Coin Bureau,2021-02-17T19:07:35Z,TOP Crypto TIPS In My Newsletter https://guy.coinbureau.com/signup 20% Fee Discount On Binance ...
NLGP-UqszVw,How To Make Money With Binance in 2022 (Beginners Guide),UCCREZW4tPMBzzDWxCIdmEyA,C Rich,2022-01-16T12:00:17Z,"This is the easiest way to start making money with Binance for beginners in 2022! In this video, I share the exact strategy I used to ..."
rdHDShM_n_Q,Binance CEO Says Crypto Showing &#39;Normal Market Behavior&#39;,UCIALMKvObZNtJ6AmdCLP7Lg,Bloomberg Markets and Finance,2022-06-16T08:55:35Z,"Binance CEO Zhao Changpeng discusses the cryptocurrency selloff, continuing hiring and M&A activity in the current environment ..."
1Wa7z3jDmb0,10 ways to earn crypto passive income on Binance,UCfYw6dhiwGBJQY_-Jcs8ozw,Binance,2021-07-10T13:00:01Z,Binance Earn Explained! How to get crypto passive income with Binance Earn. Each of the Binance Earn interest products allows ...
hA0jafKpRkc,Binance just made Bitcoin even cheaper!,UCviqt5aaucA1jP3qFmorZLQ,Crypto Jebb,2022-06-27T22:00:10Z,In this video I am going to show you what Binance.us did that is so significant and then I'm going to show you how you can ...
m2gKGTdvfpE,Binance CEO: Volatility the same in both crypto and stocks,UCF8HUTbUwPKh2Q-KpGOCVGw,CNBC International TV,2022-06-16T11:10:16Z,"Changpeng Zhao, founder and CEO of Binance, gives his outlook on crypto amid a crash in prices and looming regulatory ..."
qqtwjsH0XgM,Make $100 per day Crypto Trading Binance 2021,UCpnf3Ymd5S3zC0G7XvR0rEA,Amila Bro,2021-01-09T11:51:55Z,Binance Sinhala Course එක මෙතනින් buy කරන්න Rs.1990/= ක් පමණයි ✓ What is crypto Currency ✓ Binance ...
Hxr8e7SAr3I,Binance.US chief reveals why the company dropped bitcoin trading fees: CNBC Crypto World,UCrp_UI8XtuYfpiqluWLD7Lw,CNBC Television,2022-06-23T19:28:37Z,CNBC Crypto World features the latest news and daily trading updates from the digital currency markets and provides viewers ...
G0gmPW8N88M,What is BNB? Binance Smart Chain Explained with Animations,UCsYYksPHiGqXHPoHI-fm5sg,Whiteboard Crypto,2021-10-01T15:34:25Z,"The Binance Smart Chain, and it's native coin BNB, hold a special place in my heart. In this video, we are going to explain what ..."
OOGxVTQ3mpE,Binance CEO CZ: Tips For Crypto Beginners,UCutZa7zU3iJ4gcMCRCuFHZQ,Tech In Twi,2022-06-28T11:40:52Z,"Binance CEO CZ: Tips For Crypto Beginners About CZ CZ came from humble beginnings, as a Chinese-born immigrant in ..."
N5H7TCAupTA,"Crypto Trading In Tamil | Binance App overview in Tamil | Registration , KYC, Trading Technique",UCBUdBVp0yOo9PG8Eq4GIVZA,INDIAN FUTURE CRYPTOS,2021-03-27T17:06:33Z,Telegram Channel Link: https://t.me/Indian_Future_Cryptos Whatsapp Chat https://wa.me/+917708560812 ...
WQcyn3YdjyU,Binance Trading A - Z ( Full Work Shop ) Part One Sinhala,UC7lFA9rW_EnzOyYAB8-X7-A,Sricat,2022-04-01T13:28:06Z,Helpful links Binance Register link - https://accounts.binance.com/en/register?ref=81580654 Binance Referral CODE - 81580654 ...
isb-Y-rMf6A,Binance tutorial for beginners | ባይናንስ ለጀማሪዎች | Binance Ethiopia,UCBh4esKOTnloy4B_z663g5Q,Cryptoet,2022-02-09T23:06:45Z,"This is basic introduction to binance for beginners, enjoy! Don't forget to LIKE, COMMENT, SHARE AND SUBSCRIBE ..."
JfCLHf54AQk,LUNA COİN YENİ AÇIKLAMA FİYAT DÜŞÜYOR MU? LUNA TÜRKİYE AMACIMIZ #LUNA #BİNANCE #BİTCOİN #SHİBA #LUNC,UCTl1al5zG--OdYaKKOl9ArA,Luna Türkiye,2022-06-28T05:45:09Z,Kanala ABONE Olmayı UNUTMAYIN 2. Kanalımız ALTCOİN üzerine https://youtu.be/peHFviILSE4 https://twitter.com/KingofPara ...
FqvFkQEsgW8,LUNA CLASSIC PUMP &amp; Rettung durch Binance Burning ??,UCE1CWr_HWJVRANv3VcAR0iw,Nico 500k,2022-06-28T08:00:06Z,LUNC steigt um 35% in 24 Stunden! Burnt Binance LUNC Token? $5000 Preispool: https://partner.bitget.com/bg/LG86X1 Kurz ...
Yf0EjraF16Y,"Bitcoin falls below $25,000, Celsius and Binance pause withdrawals",UCEAZeUIeJs0IjQiqTCdVSIg,Yahoo Finance,2022-06-13T14:31:03Z,"bitcoin #Binance #Celsius #YahooFinance Yahoo Finance Live anchors Julie Hyman, Brad Smith and Brian Sozzi discuss bitcoin ..."
3EQgJPVL-zQ,How to use Binance App | Binance Complete Tutorial for Beginners,UCYH1yre7R1k2dYPaz3Zye7A,Kashif Majeed,2022-04-07T16:08:12Z,"Our Paid Courses are: ◼ Facebook Earning Course, Fiverr Earning Course, YouTube & YouTube SEO Course ◼ Whatsapp ..."
lJdRMqHegYA,Binance Exchange Tutorial 2022 | From Beginners | Part-1 | தமிழில்,UComibGh4mjHXqA8WEtbiyVg,Tamil Crypto School,2020-11-01T09:43:04Z,Binance #BinanceTutorial #BinanceTamil Binance Exchange Registration Link: ...
8a9-hqa_Lxo,Binance tutorial for beginners | How to use binance app | Vishal techzone,UCjzQLjQlYPiX_7QCrA_FelA,Vishal Techzone,2021-10-26T12:29:47Z,"Is video me maine crypocurrency exchange Binance ke bare me bataya hai, binance app kya hai, binance par account kaise ..."
l61YMeKt3v8,BINANCE WALLET HAS TRILLIONS OF TERRA LUNA CLASSIC &amp; GROWING! USTC TO $1?! BURN! CRYPTO! NEWS TODAY,UCYpGkRpqwgDSb9O80kcyOVw,Clay Hecker,2022-06-28T03:45:02Z,"Binance appears to be accumulating trillions of Terra LUNA Classic! Are they planning on doing a massive burn?! Also, USTC ..."
e9naNpl_9DY,បង្កើតលុយពី $1 ទៅ $100 តាមរយៈ Futures Trading | Crypto Futures Trading Video Tutorial,UCRjGyCw9rc7LgzkRByQmlGw,Boy Sa Moum,2022-01-26T11:00:18Z,បង្កើតលុយពី $1 ទៅ $100 តាមរយៈ Futures Trading | Crypto Futures Trading Video Guide ...
AtCGi_5D7pw,¡ATENTOS A ESTAS SEÑALES! | 🚨 Noticias Criptomonedas (HOY) | Bitcoin | ApeCoin | Sol | ADA Binance,UCoRTbiqU7rWBX3gbOKh4_Gw,Criptoniano,2022-06-27T18:08:25Z,Binance (Hasta 300$ + 20% Menos de Comisiones): https://accounts.binance.com/es/register?ref=Criptoniano . Las señales ...
yrYnatdSg-g,منصة بينانس | شرح افضل طريقة شراء العملات الرقمية بيتكوين اثيريوم و غيرها,UCN_mW5VCFDbs9q3qRBiH00Q,Tech Master I سالم البادي,2021-05-10T17:15:05Z,رابط التسجيل في بينانس بالعربي https://accounts.binance.com/ar/register?ref=29008012 منصة بينانس | شرح افضل طريقة شراء ...
x22mGGgw1bU,Binance Tutorial For Beginners in Urdu | Complete Beginner Tutorial In Cryptocurrency Trading Hindi,UCVvqOfrzu7bk9J1-Xh3dsMQ,Crypto SaQi,2021-12-10T17:37:48Z,binancetutorial #cryptoforbeginners #binancetutorialforbeginners. Join Binance With Me : https://bit.ly/3Iv3PHd Auto Trading k ...
GqCYcrWQr44,Binance - How to Buy Sell Crypto Currency USDT by Using Binance P2P System with INR - Binance India,UCWwV4qx048mo-bScv674JLw,Vineesh Rohini,2022-01-11T11:30:03Z,Binance #BinanceP2P #BuySellUSDT ▻ Join Binance: https://refer.do/binace-buysell -------------------------------- Best Crypto ...
iobN_AHhMC8,বাইনান্স ফুল টিউটোরিয়াল| ১ ঘন্টা| Binance Tutorial Bangla 2021| Binance Complete Guide|,UCifGOD05VQhCbsEcso9_-TA,Bitcoin Trading Bangla,2021-10-06T11:53:57Z,বাইনান্স ফুল টিউটোরিয়াল| ১ ঘন্টা| Binance Tutorial Bangla 2021| Binance Complete Guide| Hello ...
mW35sRpOOkU,COMO SACAR E DEPOSITAR REAL NA BINANCE SEM O PIX - Saques e Depósitos na Binance via p2p,UCk9x84cpq-zrk4e2ehRRWow,Matuto Investidor,2022-06-27T22:00:13Z,COMO SACAR E DEPOSITAR REAL NA BINANCE SEM O PIX - Saques e Depósitos na Binance via p2p Para realizar a ...
S6gtHkZNU4E,"С ЧЕГО НАЧАТЬ НОВИЧКУ НА BINANCE ? | Криптовалюта Bitcoin | Биткоин, Эфириум, Рипл | Binance",UCqbbCvJVO6E1ctxCXS4__lw,Kirill Evans,2021-02-16T11:30:02Z,Присоединяйся в наше комьюнити ➡️ https://cryptocommunity.ai​ ⭐️ Регистрация на Binance!
vdbxdaX_yHY,Binance Trading Tutorial in Hindi | How to use Binance app full Information,UCvG8PtQyrghsNZUQLqiNYng,ProBullz,2020-12-03T12:19:37Z,In this video you will know 1. How to use binance app in hindi. 2. How to trade in binance with BTC & USDT. 3. How to Buy any ...
_S7-dN6qA5s,A BINANCE ACABOU NO BRASIL!,UClwTmoMI3r-iQOW0EnaXhaw,Ronaldo Silva - Bitcoin RS,2022-06-22T22:00:12Z,"O BITCOIN é a maior criptomoeda do mundo, ele é descentralizado, digital e totalmente escalável, ter bitcoin como reserva de ..."
SDsJxItcZ34,⚡IMPORTANTE Si estas en BINANCE estas en ❌ PELIGRO!!!,UCeCGQc8k7pLRs2tJm0CDJ-Q,Emprende desde casa,2022-06-15T22:19:24Z,Nexo: https://bit.ly/3tHtWVE Payonner: https://bit.ly/37UhATj Okexs: http://bit.ly/OKEXEDC Bingbon: ...
L4-uBHMcHus,BINANCE Tuto COMPLET plateforme 2022 | DEBUTANT &amp; fonctionnalités avancées,UChlTcWDE8gd4tsl_L727NrQ,Hasheur,2020-09-26T16:30:03Z,Tutoriel Binance de A à Z. Du débutant à l'utilisateur ayant déjà son compte: ce TUTO couvre et explique les plus importantes ...
NrEQRu8hnVw,Tutorial Completo Binance 2022 | Paso a Paso Para Principiantes,UCVt4ugq2txl_szlXAO7B3-g,Adrián Sáenz,2022-01-22T18:02:58Z,Tutorial completo sobre Binance actualizado para el 2022: desde las funcionalidades mas básicas hasta las más avanzadas.
KPiyuIJgJQE,Free Binance $999 BUSD Offer - Instant Claim | Binance Offer 2022 | Online income without investment,UCdq3uV9NAKfV-ivAhfyA4xg,Grow Income,2022-06-05T03:00:11Z,Telegram Channel: https://t.me/realgrowincome/53 (টেলিগ্রামে আপনার বাইন্যান্স নতুন ...
Us7HiZIcWb4,Simple Method To Make $100 A Day Trading Cryptocurrency As A Beginner | Binance Tutorial Guide,UCBjrrP9frGRuRwoAJ4RQdag,CryptoJack,2021-06-27T11:08:46Z,OVER $16400 USD IN FREE BONUSES BELOW ✓ BYBIT FREE $4460 http://bit.ly/JackBybit BITGET FREE $5000 USD ...
Wh3Lzi4c6ho,Make Money From Binance || Binance Tutorial For Beginners,UCbLNDozrwvZcOpBzGbFMC-Q,Mr How,2022-03-16T16:15:01Z,Asalam o Alekum Everyone ! Welcome to the world of Mr. How. This video is about binance which is a cryptocurrency platform.
JRBhrVlnvnc,100% Automatic Profit | $10 To $100 Daily Earning | Binance Spot Grid Trading #cryptocurrency,UCDxlvm8pMYjt1MYzUJFLB4A,GNF Learning,2022-04-18T14:41:41Z,For More Update Visit: www.gnflearning.com Telegram Group Name Must Join: @gnflearningfans Telegram Group link ...
GZAcgbkJy-M,Binance - Binance Account Creation and KYC Verification Live Process - Tutorial for Beginners,UCWwV4qx048mo-bScv674JLw,Vineesh Rohini,2022-01-10T03:30:02Z,Binance #CryptoCurrency #Wazirx ▻ Join Binance: https://refer.do/binance-create -------------------------------- Best Crypto ...
bpHJ2WPOo2Y,Turn $10 into $1000 (Binance Futures Trading) Part 1 | Bitcoin Leverage Trading Tutorial,UCc1eMsISTD_BYlC2KHZOcwQ,Inspector Mindblow,2021-07-10T14:04:32Z,Turn $10 into $1000 (Binance Futures Trading) Part 1 Register on Binance and get 10% kickback ...
IVPhtv5S5bM,Es buena idea invertir en Binance!?,UCS3eKy88CbT4HG6slJNKpUw,Alejandro Salomon - Emprendeduro,2022-04-02T16:28:25Z,Pantuflitas y Papirrines! Una de las preguntas que mas me llegan siempre es CÓMO PUEDO EMPEZAR A INVERTIR EN ...
ITCvsaCWrV8,Binance suspende saques em reais! Veja como sacar seu dinheiro já que a Binance bloqueia deposito,UCoNkJtAvRbc0t_KR8PSNs8w,Yubb,2022-06-21T22:01:36Z,[GRATUITO] EVENTO À PROVA DE FOGO: https://bit.ly/3mvyg79 O momento decisivo nas criptomoedas para transformar o caos ...
qtU7Rd3TTFI,Binance $1000 New Offer 2022 | Binance New Offer | Binance New Event | Binance Pay New Offer,UC7L4LX53hvlT0zEWufFlN1w,FC Technical Tips,2022-06-07T08:00:07Z,binance new offer. binance offer Or binance new instant offer? binance new offer today? binance new event? binance new ...
uYlCPH_IRNw,Binance 10$ New Offer 2022 | Binance New Event | Binance New Offer | Binance Dual Investment Offer,UC7L4LX53hvlT0zEWufFlN1w,FC Technical Tips,2022-06-10T13:03:26Z,binance new offer. binance new instant offer And binance offer Or binance new offer today? binance today offer? binance new ...
JTUmh5nCt3o,BINANCE ANUNCIA VOLTA DO SAQUES  PIX SAIBA MAIS AQUI,UCw_kupPfhMVL_YlhoO_ozIQ,bitcoin news criptomoedas,2022-06-24T14:26:15Z,BINANCE ANUNCIA VOLTA DO SAQUES PIX SAIBA MAIS AQUI ATIVE O ...
ifxBjQD7_s8,Auto Invest ក្នុង Binance | Khmer Explanation,UCIw1B8cZ1o3PP1QMvSRG4_w,ជី អឹម​ ខេ ​- GMK,2022-04-13T06:18:08Z,Instagram : http://bit.ly/37KcSky Youtube : https://youtu.be/0Ac0JyoOhL0 Discord ...
cOpCdBmvrGw,How to Use Binance App in Pakistan | Learn to Buy &amp; Sell Crypto Coins from Binance,UCYH1yre7R1k2dYPaz3Zye7A,Kashif Majeed,2021-06-28T16:09:48Z,Join Binance : https://bit.ly/3dlQq70\ Biance Telegram Group: @binancepakistani Our Paid Courses are: ◼ Facebook Earning ...
gaxnPxwF9Io,Binance Daily Earning Trick | Binance Trading Best Strategy | #binancetrick,UCDxlvm8pMYjt1MYzUJFLB4A,GNF Learning,2022-04-03T12:23:47Z,For More Update Visit: www.gnflearning.com Telegram Group Name Must Join: @gnflearningfans Telegram Group link ...
