id,title,channel_id,channel_name,published_date,description
yMtboJwmsgM,Dogecoin Price ABOUT TO TRIPLE,UCXqaGIjJysa810FJKvYvcJQ,Final Stand,2022-06-28T02:59:19Z,Join our crypto pick club where many of the biggest picks in crypto history are called early: https://www.patreon.com/mattwallace ...
gzebmHe5ZJg,DOGECOIN BREAKING NEWS! CRYPTO.COM JUST DID THIS TO DOGE? NEXT 48 HOURS WILL BE CRITICAL!!,UCyzDtZVP6Rlb-Yg3R5rY8Pg,Crypto Daily Trade Signals,2022-06-28T12:45:14Z,DOGECOIN BREAKING NEWS! CRYPTO.COM JUST DID THIS TO DOGE? NEXT 48 HOURS WILL BE CRITICAL FOR BITCOIN ...
evf64ce05Io,BAD NEWS FOR CRYOTO,UCXqaGIjJysa810FJKvYvcJQ,Final Stand,2022-06-28T04:05:21Z,Join our crypto pick club where many of the biggest picks in crypto history are called early: https://www.patreon.com/mattwallace ...
nwc7rg3QWYU,MASSIVE CRYPTO UPDATE AND WARNING!!!! #DOGECOIN #CRYPTO #BITCOIN,UCo0pfxcIxqqNRY3i_sbesIQ,Myles G Investments,2022-06-27T17:29:16Z,MASSIVE CRYPTO UPDATE AND WARNING!!!! #DOGECOIN #CRYPTO #bitcoin DOGECOIN UPDATE NEWS ELONMUSK ...
hl9jJwWIDNw,Dogecoin&#39;s Volume is $1.1 Billion In The Last 24 Hours | Defies Gravity | Dogecoin News,UCbu9Jq1ewrfp1ZjCS-aKRQA,David Mitchell Jr,2022-06-28T02:00:09Z,Ledger Nano X Crypto Hardware Wallet & Ledger Nano S Crypto Hardware Wallet https://shop.ledger.com/?r=01f1d3f5672a ...
BLDijPZLK74,When Dogecoin Will START RISING! 🔥 Dogecoin NOT MOVING! *PREDICTION &amp; NEWS*,UC5ObMMzE4zLy7sgNj0xEmUQ,Roger Garcia,2022-06-28T03:15:01Z,Dogecoin has pulled back and setting itself up for and uptrend. Dogecoin has a high level of interest from investors in the crypto ...
yvi9YTF2gww,BULLISH CRYPTO NEWS UPDATE!!! 🚀🚀🚀🚀🚀🚀🚀,UCo0pfxcIxqqNRY3i_sbesIQ,Myles G Investments,2022-06-28T00:05:34Z,"FTX CEO BUYING ROBINHOOD, BULLISH CRYPTO NEWS!!!!! CRYPTO UPDATE NEWS TECHNICAL ANALYSIS MARKET ..."
OQGrProf2k8,🚨Crypto.com SHIBA VE DOGECOIN HAMLESİ🚨,UCzQJUS7TjP4TZzb7lEqzMzg,Murat Tufanoğlu,2022-06-28T09:39:32Z,MEXC Borsasına aşağıdaki linkten üye olarak tüm işlemlerde %30 daha az komisyon ödersiniz https://m.mexc.com/auth/signup ...
Z-vpZGuY1_g,Dogecoin News! DOGE back to $0.10?,UC9o-KkHtUgAaakX1773UVMw,Zach Humphries,2022-06-28T09:00:13Z,Dogecoin News! DOGE back to $0.10? Latest news on Dogecoin. Dogecoin could be primed to move up if the entire market ...
0c-VR7hcOGM,NEVER SEEN THIS BEFORE!! DOGECOIN JUST DID THIS? LATEST NEWS &amp; UPDATES,UCyzDtZVP6Rlb-Yg3R5rY8Pg,Crypto Daily Trade Signals,2022-06-27T15:30:12Z,HISTORY IN THE MAKING!! DOGECOIN JUST DID THIS? LATEST NEWS & UPDATES * THIS VIDEO IS NOT FINANCIAL ...
G8VnXdDCukY,DOGECOIN 🔥 FAKE DOGE RECOVERY! DOGE GOING TO .10? *PREDICTION &amp; NEWS*,UC5ObMMzE4zLy7sgNj0xEmUQ,Roger Garcia,2022-06-27T21:30:01Z,Dogecoin is pulling back on the day as the entire crypto market is pulling back. Dogecoin has seen an increase in trading volume.
K87tpI0iZSQ,Dogecoin Rally!,UCZItcoS4T9O3WA_rhdii78A,Kriss,2022-06-27T13:06:27Z,I use Binance(dot)us for buying crypto. You can join Binance(dot)us by clicking on this link: ...
ZUtoEUsRraw,Is Dogecoin Finally Dead?,UCEjgpiDPhTErrJm6zeNeAAw,The Bitcoin Express,2022-06-27T16:37:46Z,"Dogecoin was created as a joke in 2013, by Billy Markus and Jackson Palmer. Since then Dogecoin has made its way into the top ..."
Hg40piKphKY,🚨 Bitcoin | Dogecoin | Ripple | खतरा अभी टला नही है | Crypto News Today Hindi,UCQemzRWOMazoaSuULUuSCpg,Trade for Profit,2022-06-28T08:05:33Z,Best Stock Trading platform in INDIA https://zerodha.com/?c=PQ9127&s=CONSOLE ...
JpCwXHwXWpA,Dogecoin Shorts Are Running Down &amp; Price is Running Up | Why? | Dogecoin News,UCbu9Jq1ewrfp1ZjCS-aKRQA,David Mitchell Jr,2022-06-26T22:20:10Z,Ledger Nano X Crypto Hardware Wallet & Ledger Nano S Crypto Hardware Wallet https://shop.ledger.com/?r=01f1d3f5672a ...
Rt5KQ2XhuD0,🔴 HOJE É O GRANDE DIA DE BABY DOGECOIN A CRIPTOMOEDA MEME QUE ESTÁ SUPERANDO TUDO! 🔴,UCOmv3iypog41GqbdvdOMqUg,Dicas do Renan,2022-06-28T11:00:13Z,"VÍDEOS DIVERSIFICADOS QUE SEMPRE TRAZEM ALGO NOVO PARA SUA VIDA.Baby Doge é fofo, mas com muita MORDIDA!"
-Bj98fHCs2k,Dogecoin GOING VIRAL (18 Million),UCXqaGIjJysa810FJKvYvcJQ,Final Stand,2022-06-26T22:23:19Z,URGENT! Join our crypto pick club where many of the biggest picks in crypto history are called early: ...
BCQzmZze-RI,DOGECOIN IS DOING WHAT????,UCyzDtZVP6Rlb-Yg3R5rY8Pg,Crypto Daily Trade Signals,2022-06-27T13:00:15Z,DOGECOIN IS DOING WHAT???? * THIS VIDEO IS NOT FINANCIAL ADVISE & FOR EDUCATIONAL PURPOSES ONLY!
Ohss75bXR24,WATCH OUT!!! ELON MUSK IS BUYING DOGECOIN - THESE ARE THE BEST CRYPTOS TO BUY NOW BAR NONE!,UCoMzWLaPjDJBbipihD694pQ,Stock Moe,2022-06-25T20:31:29Z,Up to 11 FREE STOCKS!!! - Moomoo https://j.moomoo.com/006l1U Austrailan Moomoo: https://j.moomoo.com/00k5ws ⚠️6 ...
iRH4hkWV55M,Dogecoin FORMING MASSIVE SPIKE (Nobody is paying attention to this) ⚠️,UCXqaGIjJysa810FJKvYvcJQ,Final Stand,2022-06-26T03:31:57Z,Join our crypto pick club where many of the biggest picks in crypto history are called early: https://www.patreon.com/mattwallace ...
s6RVeeAqHX0,Dogecoin Fiyatı Bu Hafta 3X Yapabilir - DOGECOİN SON DURUM / Kripto Para Haberleri,UC_hRlz4XEjhXbTrSpZmSN9g,KRİPTO AİLESİ,2022-06-28T09:00:33Z,Dogecoin Fiyatı Bu Hafta 3X Yapabilir - DOGECOİN SON DURUM / Kripto Para Haberleri ve dogecoinin analizi için kanalımızdaki ...
VQYg_XrKsoQ,DOGECOIN GOING CRAZY!!! MASSIVE CRYPTO UPDATE!!!!! #BITCOIN #DOGECOIN #SHIBAINU,UCo0pfxcIxqqNRY3i_sbesIQ,Myles G Investments,2022-06-27T01:30:43Z,DOGECOIN GOING CRAZY!!! MASSIVE CRYPTO UPDATE!!!!! #BITCOIN #DOGECOIN #shibainu CRYPTO NEWS CRYPTO ...
aua0cfBKumI,FINALMENTE RICOS!! BABY DOGECOIN CONFIRMOU A QUEIMA TÃO ESPERADA - MAS QUAL A DATA DA QUEIMA? - VEJA,UC97ahDWPAg0ROsuJSdG5OeA,Cripto Marte,2022-06-27T22:00:10Z,INFORMAÇÕES PROJETO BITWAY - CNPJ DA EMPRESA: 44910573/0001-28 - GRUPO TELEGRAM: https://t.me/bitwaytoken ...
sZ-ga0oZSco,🚨 BABY DOGECOIN! 500 REAIS TE DEIXA MILIONÁRIO? QUANTO TEREI INVESTINDO HOJE?,UC_97bCjPNeuw3IX9tiGegRQ,Em minutos[CRIPTO],2022-06-27T21:00:34Z,BABY DOGECOIN! 500 REAIS TE DEIXA MILIONÁRIO? QUANTO TEREI INVESTINDO HOJE? Hoje eu considero a Binance a ...
wYwrIKAgnUI,🚨 BABY DOGECOIN! A QUEIMA DOS 50 QUATRILHÕES VAI MOVIMENTAR O PREÇO? Crypto News,UCxGhz0Pca11GBuPo13VpDbA,Crypto News,2022-06-28T01:50:16Z,BABY DOGECOIN! A QUEIMA DOS 50 QUATRILHÕES VAI MOVIMENTAR O PREÇO? Crypto News BABY DOGE COIN A ...
vwHLOpp4eVI,BITCOIN BIG URGENT UPDATE🔥🚀DOGECOIN PRICE PREDICTION.CRYPTO NEWS TODAY.,UC5rw3GCUhO4aWLjW5XkqiSw,Crypto King India,2022-06-27T07:57:19Z,Crypto Urgent Update | Top altcoin to Buy Now | Crypto News today | Cryptocurrency VIP CHANNEL ...
PK4eLqozfJU,baby dogecoin 50 Quadrillion burning news today hindi | baby dogecoin burning ke baad $10 hoga !!,UC6fXT-mmckOpQxXzUSg3S3w,TFE CRYPTO,2022-06-28T07:44:11Z,baby dogecoin 50 Quadrillion burning news today hindi | baby dogecoin burning ke baad $10 hoga !! Satoshi Bitcoin Mining ...
EyOocPGWFX0,The Start of a Dogecoin Rise? 🔥 Dogecoin Needs to Break .10 Next! *PREDICTION &amp; NEWS*,UC5ObMMzE4zLy7sgNj0xEmUQ,Roger Garcia,2022-06-26T21:30:01Z,Dogecoin has pushed up and seen an increase in price. Dogecoin has also seen a rise in bullish momentum and showing signs ...
GEbYzWXZF8Y,The Tragic Downfall Of The Dogecoin Millionaire,UCV6KDgJskWaEckne5aPA0aQ,Graham Stephan,2022-06-06T22:30:02Z,"GET UP TO $100 OF FREE CRYPTO: Trade Bitcoin, Doge, and other crypto with zero fees on FTX. Use my referral code ..."
-1vxT0fz8-Q,Dogecoin Price Breakout This Week?? Here Is Why? Doge To The Moon,UCyzDtZVP6Rlb-Yg3R5rY8Pg,Crypto Daily Trade Signals,2022-06-26T15:15:14Z,"Huge Breaking News!! Doge to 11 Cents, Bitcoin $30000 This Week!! WOW! * THIS VIDEO IS NOT FINANCIAL ADVISE & FOR ..."
e6p6IeHVMkQ,DogeCoin ราคาจะขึ้นไป 20 บาท | Crypto เล่า Ep.293,UCrFgjjTCNTppU4lIfQsOONg,IBCOIN,2022-06-27T00:33:00Z,คลิปนี้ผมจะมาวิเคราะห์กราฟ DogeCoin ให้ชม หวังว่าทุกคนคงจะเข้าใจและได้กำไรทุกคนนะ ใครที่ยังไม่มี Binance สมัครได้ที่นี่ ...
jx_DsQYYr0k,Breaking Report:- 🚨 इतिहास का सबसे खराब Bear Market | Crypto News today | Dogecoin pump | Bitcoin,UCNL5TkqNmy22oT9QpWJpOvQ,Samjha Do Bhaiya,2022-06-27T12:21:54Z,Samjha Do Bhaiya Instagram :-https://www.instagram.com/samjhadobhaiya Samjha Do ...
Zpnyby4XnyQ,What Elon Musk Just Said About Dogecoin And Why We Should All Pay Attention,UCDmYh9SPzXLf2_NOHR702JQ,CryptoX,2022-06-22T00:07:53Z,Join My Patreon & Discord Community to Become a Smarter Investor! https://www.patreon.com/cryptox_ Email for Business ...
W91oAWPctWE,I Survived 24 Hours on Only Dogecoin,UCnmGIkw-KdI0W5siakKPKog,Ryan Trahan,2021-06-04T16:00:29Z,surviving on dogecoin for 24 hours changed my life Follow me on IG @ryantrahan for more fun times ;) gaming channel ...
PGbXtkt4v-Q,Shiba Inu New Listing | Baby Dogecoin पर रखें नज़र | Happy Birthday Elon Musk,UCMjSHSa-puinagDEalxuxgA,Oyeee Rahul,2022-06-28T06:15:45Z,Hey Everyone Kaise hain aap Sab Telegram Channel - https://t.me/oyeeerahul1 Twitter - https://twitter.com/oyeee_rahul SIP ...
p3cgfWN45LY,DOGECOIN ZİNCİRİNİ KIRIYOR,UCJ5gxkyh3GghkKPpluUCxIA,Sedat Yılmaz,2022-06-27T07:33:59Z,DOGECOIN IN SON FİYAT HAREKETLİLİKLERİNİ ELE ALDIĞIM BİR DOGECOIN VİDEOSUDUR #dogecoin Aşağıdaki referans ...
qgipi2xVfFI,MUCH WOW! Dogecoin Latest Prices Today &amp; Doge Price Predictions.. So Much Positive News Right Now!,UCyzDtZVP6Rlb-Yg3R5rY8Pg,Crypto Daily Trade Signals,2022-06-26T10:30:13Z,MUCH WOW! Dogecoin Latest Prices Today & Doge Price Predictions.. So Much Positive News Right Now! * THIS VIDEO IS NOT ...
Xs0HvTDhRoo,"DOGECOIN, SHIBA INU, + CRYPTO ABOUT TO GO CRAZY!!!! 🚀🚀🚀 #DOGECOIN #SHIBAINU #ETHEREUM",UCo0pfxcIxqqNRY3i_sbesIQ,Myles G Investments,2022-06-24T15:48:51Z,PATREON: MOST PROFITABLE CRYPTO TRADE ALERTS ON THE INTERNET AND MUCH MORE:HTTPS://WWW.PATREON.
WzP87OV3lYU,HOW MUCH WILL 1000 DOGECOIN TOKENS BE WORTH BY 2025? - DOGE Dogecoin Cryptocurrency,UCoKR904WViyqa-h3pI636GA,Crypto Diary,2021-08-25T16:20:41Z,"After this video, you would have learned how much 1000 DOGE will be worth by 2025. Binance (Best platform to start investing): ..."
nTKb0QSAZhE,🔴 BABY DOGECOIN COMEÇA SE TORNAR ESCASSA COM QUEIMAS MASSIVAS DE CRIPTOMOEDAS! 🔴,UCOmv3iypog41GqbdvdOMqUg,Dicas do Renan,2022-06-26T17:15:03Z,"VÍDEOS DIVERSIFICADOS QUE SEMPRE TRAZEM ALGO NOVO PARA SUA VIDA.Baby Doge é fofo, mas com muita MORDIDA!"
lGFThyFIdEA,Elon Musk Dogecoin LawSuit EXPOSED ⚠️,UCXqaGIjJysa810FJKvYvcJQ,Final Stand,2022-06-24T02:32:04Z,URGENT! Join our crypto pick club where many of the biggest picks in crypto history are called early: ...
rX6qY9ZsTYM,🚨 BABY DOGECOIN! ENTENDA O GAME E DÊ UM PASSO A FRENTE! Crypto News,UCxGhz0Pca11GBuPo13VpDbA,Crypto News,2022-06-26T02:28:08Z,BABY DOGECOIN! ENTENDA O GAME E DÊ UM PASSO A FRENTE! Crypto News BABY DOGE COIN A criptomoeda Baby ...
5f2eG2cCJ94,DOGECOIN CAN EXPLODE AT THIS KEY LEVEL FAST!!,UCExKp2RcNi6dv7zhwHXx7dQ,Will Knowledge Crypto,2022-06-26T21:03:12Z,DOGECOIN CAN EXPLODE AT THIS KEY LEVEL FAST!! GET MY BUYS & SELLS FOR CRYPTO! JOIN THE TEAM!
CNQYz0WV0uc,What Michael Saylor Just Said About Dogecoin And Why We Should All Pay Attention,UCDmYh9SPzXLf2_NOHR702JQ,CryptoX,2022-06-19T01:51:43Z,Email for Business Inquiries: @legend.visuals999@gmail.com Telegram: https://t.me/cryptox7 6 Free Webull Stocks valued up to ...
ZHwPwp_hTOM,I REGRET EVERYTHING.,UCvRP2JVdPZxPqdLFsv_VTmQ,The Dogecoin Millionaire,2022-06-15T06:11:22Z,Get Your DogeCard with my link below https://dogeapp.cc/PH4bpj6oqVRE9irN7 Buy some MUCH WOW merch! (click on the ...
xGMvuNWflMA,Buy Of 2022? My Numbers | Why I&#39;m Taking Advantage Of These Prices | Dogecoin News,UCbu9Jq1ewrfp1ZjCS-aKRQA,David Mitchell Jr,2022-06-24T02:57:08Z,Ledger Nano X Crypto Hardware Wallet & Ledger Nano S Crypto Hardware Wallet https://shop.ledger.com/?r=01f1d3f5672a ...
ibLADeqkbu4,✅BOMBA CARDANO Y DOGECOIN! 🚨Criptonoticias Noticias Criptomonedas Hoy 27 junio 2022,UCuCJEQsqun9ZYobkpROIrsQ,HORA CRIPTO,2022-06-27T10:45:02Z,Conviértete en miembro de este canal para disfrutar de ventajas: ...
BfTjh4zKe_c,DOGECOIN 🔥 3X RISE COMING FOR DOGE NOW? DOGE RECOVERY! *PREDICTION &amp; NEWS*,UC5ObMMzE4zLy7sgNj0xEmUQ,Roger Garcia,2022-06-25T21:30:00Z,Dogecoin has bullish trading activity that can allow it to see an increase in price. Dogecoin is the most popular cryptocurrency ...
Fig7X1rFOJ0,China Sending Dogecoin &amp; Bitcoin To $0 ⚠️ URGENT UPDATE ⚠️,UCXqaGIjJysa810FJKvYvcJQ,Final Stand,2022-06-23T03:40:18Z,URGENT! Join our crypto pick club where many of the biggest picks in crypto history are called early: ...
Pa-Q74HjkNg,"WOW, DOGECOIN RILIS SMART CONTRACT DOGECHAIN ?? DOGE UPGRADE BLOCKCHAIN ??",UCrtXSXcwRqUKTgQmd3gRThw,DUTA CRYPTO,2022-06-25T12:00:12Z,Ada rumor yang beredar bahwa dogecoin akan merilis smart contract yang bernama Dogechain. Ini dibuat untuk menambah ...
